{
  "version": "2026.05.21.7",
  "baseUrl": "",
  "albums": [
    {
      "id": "world-cup-2026",
      "revision": 1,
      "manifestPath": "/albums/world-cup-2026/album.json"
    },
    {
      "id": "retro-games",
      "revision": 2,
      "manifestPath": "/albums/retro-games/album.json"
    },
    {
      "id": "space-explorers",
      "revision": 2,
      "manifestPath": "/albums/space-explorers/album.json"
    }
  ],
  "appConfig": {
    "packCooldown": { "value": 1, "unit": "hours" },
    "packMaxAccumulation": 5,
    "packBonusPerUniqueTrade": 1,
    "stickersPerPack": 4,
    "tradeRequiresConfirmation": true,
    "signature": {
      "authorName": "Raythan",
      "taglineKey": "about.tagline",
      "links": {
        "github": "https://github.com/Raythan",
        "linkedin": "https://www.linkedin.com/in/raythan"
      }
    }
  }
}
